ModelNumber,Name,Category,Colors,Status
"1101471","SUPERIOR DOWN PANTS MEN'S","INSULATION","BK;PAPRI;PUID","No mapping"
"1101472","SUPERIOR DOWN PANTS WOMEN'S","INSULATION","BK;PAPRI;PUID","No mapping"
"1101490","THERMAWRAP PANTS KID'S","KIDS & BABY","BK;DGN","No mapping"
"1101491","THERMAWRAP PANTS KID'S","KIDS & BABY","BK;DGN","No mapping"
"1101528","PLASMA 1000 ALPINE DOWN PARKA MEN'S","INSULATION","BK;LGY;PUID","No mapping"
"1101531","PLASMA 1000 DOWN VEST WOMEN'S","INSULATION","DKNV;WT","No mapping"
"1101538","U.L. THERMAWRAP PARKA MEN'S","INSULATION","BK24;NV;OG1","No mapping"
"1101541","U.L. THERMAWRAP VEST MEN'S","INSULATION","BK;GY","No mapping"
"1101543","U.L. THERMAWRAP PANTS","INSULATION","BK;TAUPE","No mapping"
"1101547","HUSKY COAT MEN'S","TRAVEL & COUNTRY","BK;BN;DGN","No mapping"
"1101549","TRAVEL DOWN PARKA WOMEN'S","TRAVEL & COUNTRY","DBN;SVWT;TRBK","No mapping"
"1101550","TRAVEL DOWN LONG COAT WOMEN'S","TRAVEL & COUNTRY","DKSP;LTKH;TRBK","No mapping"
"1101563","U.L. THERMAWRAP T","INSULATION","GY;NV","No mapping"
"1101568","BERNINA DOWN COAT WOMEN'S","TRAVEL & COUNTRY","BK;MR","No mapping"
"1101569","HUSKY COAT WOMEN'S","TRAVEL & COUNTRY","BRIC;HTGN","No mapping"
"1101575","LIGHT ALPINE DOWN PANTS MEN'S","INSULATION","BK;DKNV","No mapping"
"1101576","LIGHT ALPINE DOWN PANTS WOMEN'S","INSULATION","BK;DKNV","No mapping"
"1101606","LIGHT ALPINE DOWN PARKA MEN'S","INSULATION","BK;DKFO;IND;PAPRI;STBL","No mapping"
"1101608","LIGHT ALPINE DOWN JACKET MEN'S","INSULATION","BK;BRIC;IND;OLYL","No mapping"
"1101610","LIGHT ALPINE DOWN VEST MEN'S","INSULATION","BK;BKOV;IND","No mapping"
"1101615","BERNINA DOWN COAT MEN'S","TRAVEL & COUNTRY","BK;LTN","No mapping"
"1101633","THERMAWRAP ROUND NECK JACKET KID'S","KIDS & BABY","BK/KG;IV;OC/NV","No mapping"
"1101634","THERMAWRAP ROUND NECK JACKET KID'S","KIDS & BABY","BK;DGN;LT/MT","No mapping"
"1101663","SUPERIOR DOWN VEST MEN'S","INSULATION","BK;WRD","No mapping"
"1101664","SUPERIOR DOWN VEST WOMEN'S","INSULATION","IV;NV","No mapping"
"1101665","SUPERIOR DOWN T","INSULATION","BK;BN","No mapping"
"1101667","SUPERIOR DOWN ROUND NECK JACKET WOMEN'S","INSULATION","BK;GAR;KH;TQ;YL","No mapping"
"1101668","SUPERIOR DOWN ROUND NECK T MEN'S","INSULATION","BK;DGN","No mapping"
"1101669","SUPERIOR DOWN ROUND NECK T WOMEN'S","INSULATION","BK;GAR;YL","No mapping"
"1101670","SUPERIOR DOWN ROUND NECK VEST MEN'S","INSULATION","BK;TN","No mapping"
"1101671","SUPERIOR DOWN ROUND NECK VEST WOMEN'S","INSULATION","BK;KH;YL","No mapping"
"1101672","SUPERIOR DOWN V-NECK VEST MEN'S","INSULATION","BK;NV","No mapping"
"1101675","LIGHT ALPINE DOWN PARKA WOMEN'S","INSULATION","BGN;IV;NV;PU","No mapping"
"1101676","LIGHT ALPINE DOWN JACKET WOMEN'S","INSULATION","BGN;IV;NV;PU","No mapping"
"1101677","LIGHT ALPINE DOWN VEST WOMEN'S","INSULATION","IV;NV;PU","No mapping"
"1101684","SUPERIOR DOWN TRAVEL COAT WOMEN'S","TRAVEL & COUNTRY","BK;DNV;IV;KH","No mapping"
"1101690","EX LIGHT THERMAWRAP VEST MEN'S","INSULATION","BGN;BK","No mapping"
"1101692","U.L. THERMAWRAP ROUND NECK VEST MEN'S","INSULATION","BK;NV","No mapping"
"1101694","ASPEN DOWN HALF-LENGTH COAT MEN'S","TRAVEL & COUNTRY","BK;KH","No mapping"
"1101695","ASPEN DOWN COAT WOMEN'S","TRAVEL & COUNTRY","BK;LGY","No mapping"
"1101703","THERMAWRAP WARM PANTS KID'S","KIDS & BABY","LGY;NV","No mapping"
"1101704","THERMAWRAP WARM PANTS KID'S","KIDS & BABY","LGY;NV","No mapping"
"1101706","IGNIS DOWN PARKA MEN'S","INSULATION","BGN;BK;OG;TN","No mapping"
"1101707","IGNIS DOWN PARKA WOMEN'S","INSULATION","BK;LGY;YL","No mapping"
"1101708","ALPINE DOWN PARKA MEN'S","INSULATION","BGN;NV;OG","No mapping"
"1101710","ALPINE DOWN JACKET MEN'S","INSULATION","BL;NV;RD","No mapping"
"1101711","ALPINE DOWN JACKET WOMEN'S","INSULATION","IV;NV","No mapping"
"1101716","PERMAFROST LIGHT DOWN JACKET WOMEN'S","INSULATION","DBN;IV;NV","No mapping"
"1101717","SUPER DRY-TEC DOWN PANTS MEN'S","INSULATION","BK;NV","No mapping"
"1101718","SUPER DRY-TEC DOWN PANTS WOMEN'S","INSULATION","BK","No mapping"
"1101723","U.L. TRAVEL DOWN COAT WOMEN'S","TRAVEL & COUNTRY","BK;KH;LGY","No mapping"
"1101724","NEIGE DOWN COAT WOMEN'S","TRAVEL & COUNTRY","BK;DBN","No mapping"
"1102325","CLIMAPLUS 100 WITH SHELL JACKET","TRAVEL & COUNTRY","BK24;DKNV;KH;LGY","No mapping"
"1102572","DROITES PARKA MEN'S","ALPINE CLOTHING","BL;DGY;RD","No mapping"
"1102579","PUMORI PARKA WOMEN'S","ALPINE CLOTHING","LGY;TQ;YL","No mapping"
"1103253","O.D. VEST MEN'S","VEST","BK;BRDL;BRIC;DN/DN","No mapping"
"1103254","O.D. VEST WOMEN'S","VEST","IV;NV24;WRD","No mapping"
"1103304","COMPACT TRAVEL COAT","TRAVEL & COUNTRY","BK;DKNV","No mapping"
"1103333","NATURE GUIDE LIGHT VEST MEN'S","VEST","DGN;TN","No mapping"
"1103354","O.D. V-NECK VEST MEN'S","VEST","NV;TN","No mapping"
"1104812","WICKRON STRIPED LONG SLEEVE T KID'S","KIDS & BABY","BR/WT;IV/DN;WT/RD","No mapping"
"1104813","WICKRON STRIPED LONG SLEEVE T KID'S","KIDS & BABY","BR/WT;IV/DN;WT/RD","No mapping"
"1104938","WICKRON ZEO LONG SLEEVE T MEN'S","KNIT SHIRTS","DUGN;GM;IND;OG;WT25","No mapping"
"1104939","WICKRON ZEO LONG SLEEVE T WOMEN'S","KNIT SHIRTS","CHGY;LBL;PU;WTH","No mapping"
"1104940","WICKRON ZEO LONG SLEEVE ZIP SHIRT MEN'S","KNIT SHIRTS","BL;DUGN;GM;OG;WTH","No mapping"
"1104941","WICKRON ZEO LONG SLEEVE ZIP SHIRT WOMEN'S","KNIT SHIRTS","CHGY;LBL;PU;WT23","No mapping"
"1105511","THERMAWRAP SHORTS WOMEN'S","PANTS","BK/GP;KH","No mapping"
"1105540","TRAIL ACTION TIGHTS MEN'S","THERMAL","BK;DKNV","No mapping"
"1105541","TRAIL ACTION TIGHTS WOMEN'S","THERMAL","BK;DKNV","No mapping"
"1105598","THERMAWRAP SKIRT","PANTS","BK/MD;KH;WRD","No mapping"
"1105673","O.D. PANTS MEN'S","PANTS","DKCH;DKTL;TN","No mapping"
"1105674","O.D. PANTS WOMEN'S","PANTS","DKCH;DKNV;OV","No mapping"
"1105677","SOUTH RIM PANTS MEN'S","PANTS","BK;DPFO;LTN","No mapping"
"1105678","SOUTH RIM PANTS WOMEN'S","PANTS","BKNV;BNSD;GRPH","No mapping"
"1105681","CLIFF PANTS MEN'S","PANTS","BN;DGY;NV","No mapping"
"1105682","CLIFF PANTS WOMEN'S","PANTS","BK24;LGY;NV","No mapping"
"1105685","GUIDE PANTS MEN'S","PANTS","DGY;KH;NV","No mapping"
"1105686","GUIDE PANTS WOMEN'S","PANTS","BK24;LGY;NV","No mapping"
"1105692","LINED SOUTH RIM PANTS MEN'S","PANTS","BKOV;GM","No mapping"
"1105693","LINED SOUTH RIM PANTS WOMEN'S","PANTS","BKOV;DKNV","No mapping"
"1105699","THERMAL O.D. PANTS MEN'S","PANTS","BK;DGY;NV","No mapping"
"1105700","THERMAL O.D. PANTS WOMEN'S","PANTS","DGY;NV","No mapping"
"1105707","LINED O.D. PANTS MEN'S","PANTS","DGN;DGY;TN","No mapping"
"1105708","LINED O.D. PANTS WOMEN'S","PANTS","DGN;DGY;NV","No mapping"
"1105734","LINED O.D. PANTS KID'S","KIDS & BABY","DGN;NV;TN","No mapping"
"1105735","LINED O.D. PANTS KID'S","KIDS & BABY","DGN;NV;TN","No mapping"
"1105753","MULTIUSE TROUSERS MEN'S","PANTS","BK;NV","No mapping"
"1105754","MULTIUSE TROUSERS WOMEN'S","PANTS","BK;NV","No mapping"
"1105755","CLIFF HALF-LEG SHELL PANTS MEN'S","PANTS","BGN;DGY","No mapping"
"1105756","CLIFF HALF-LEG SHELL PANTS WOMEN'S","PANTS","BGN;DGY","No mapping"
"1105759","THERMAWRAP SHORTS MEN'S","PANTS","BGN;BK","No mapping"
"1105763","ALPINE THERMAL EASY-FIT PANTS KID'S","KIDS & BABY","BK;DTL","No mapping"
"1105764","O.D. THERMAL WRAP SHORTS KID'S","KIDS & BABY","BK;BL","No mapping"
"1105765","O.D. THERMAL WRAP SHORTS KID'S","KIDS & BABY","BK;BL","No mapping"
"1105766","ALPINE THERMAL PANTS KID'S","KIDS & BABY","DGN;NV;TN","No mapping"
"1105767","ALPINE THERMAL PANTS KID'S","KIDS & BABY","NV;TN","No mapping"
"1105775","CHAMEECE PANTS MEN'S","THERMAL","BK","No mapping"
"1105776","CHAMEECE PANTS WOMEN'S","THERMAL","BK","No mapping"
"1106580","CLIMAPLUS 200 JACKET MEN'S","THERMAL","BK;DGN;OTML;PUID","No mapping"
"1106582","CLIMAPLUS 200 VEST MEN'S","THERMAL","BK;HCH;PUID","No mapping"
"1106583","CLIMAPLUS 200 VEST WOMEN'S","THERMAL","GY;OTML","No mapping"
"1106584","CLIMAPLUS 200 LINED JACKET MEN'S","THERMAL","BK;HCH;IV;NV","No mapping"
"1106585","CLIMAPLUS 200 LINED JACKET WOMEN'S","THERMAL","GY;OTML","No mapping"
"1106587","CLIMAPLUS KNIT JACKET MEN'S","THERMAL","DBN;DKNV;FOST;HC/GM","No mapping"
"1106588","CLIMAPLUS KNIT JACKET WOMEN'S","THERMAL","DKNV;IV;OG","No mapping"
"1106589","CLIMAPLUS KNIT HOODED JACKET MEN'S","THERMAL","BK;BL;DBN;PAPRI","No mapping"
"1106590","CLIMAPLUS KNIT HOODED JACKET WOMEN'S","THERMAL","DKNV;IV;OG","No mapping"
"1106591","CLIMAPLUS 100 JACKET MEN'S","THERMAL","DKNV;GN;IV;OG;RD;STBL","No mapping"
"1106592","CLIMAPLUS 100 JACKET WOMEN'S","THERMAL","DBN25;DGY;EP;LBL;RSMT;YL","No mapping"
"1106593","CLIMAPLUS 100 PULLOVER MEN'S","THERMAL","BK25;BLBK;IV","No mapping"
"1106594","CLIMAPLUS 100 PULLOVER WOMEN'S","THERMAL","DGY;YL","No mapping"
"1106597","CLIMAPLUS 100 OUTER JACKET MEN'S","THERMAL","BK;IV;NV;WRD","No mapping"
"1106598","CLIMAPLUS 100 OUTER JACKET WOMEN'S","THERMAL","DBN25;IV22;PU","No mapping"
"1106599","CLIMAPLUS 100 WARM UP HOODED JACKET MEN'S","THERMAL","GY;IV;NV","No mapping"
"1106600","CLIMAPLUS 100 WARM UP HOODED JACKET WOMEN'S","THERMAL","DGY;IV","No mapping"
"1106601","CLIMAPLUS 100 VEST MEN'S","THERMAL","IV;PUID;STBL","No mapping"
"1106603","CLIMAPLUS 100 ZIP VEST MEN'S","THERMAL","PUID;RD;STBL","No mapping"
"1106604","CLIMAPLUS 100 ZIP VEST WOMEN'S","THERMAL","DGY;RSMT","No mapping"
"1106605","CLIMAPLUS 100 LITE SWEATPANTS MEN'S","THERMAL","BGN;BK","No mapping"
"1106606","CLIMAPLUS 100 JACKET KID'S","KIDS & BABY","GN;IV;NV","No mapping"
"1106607","CLIMAPLUS 100 JACKET KID'S","KIDS & BABY","IV;TQ;YL","No mapping"
"1106608","CLIMAPLUS 100 VEST KID'S","KIDS & BABY","IV;NV","No mapping"
"1106609","CLIMAPLUS 100 VEST KID'S","KIDS & BABY","IV;NV","No mapping"
"1106623","TRAIL ACTION HOODED JACKET KID'S","KIDS & BABY","BK/BK;CARNA;SPBL","No mapping"
"1106624","TRAIL ACTION HOODED JACKET KID'S","KIDS & BABY","CARNA;SPBL","No mapping"
"1106664","CLIMAPLUS KNIT CARDIGAN WOMEN'S","THERMAL","BK;DBN;DKNV;IV","No mapping"
"1106688","CLIMAAIR LINED JACKET MEN'S","THERMAL","BK;DGN;NV","No mapping"
"1106689","CLIMAAIR LINED JACKET WOMEN'S","THERMAL","IV;NV;STGN","No mapping"
"1106697","CLIMAAIR JACKET KID'S","KIDS & BABY","BK;BLRI;IV;TQ","No mapping"
"1106698","CLIMAAIR JACKET KID'S","KIDS & BABY","BK;BL;IV;PK","No mapping"
"1106699","CLIMAAIR VEST KID'S","KIDS & BABY","BK;BLRI;IV;TQ","No mapping"
"1106700","CLIMAAIR VEST KID'S","KIDS & BABY","BL;IV;NV;PK","No mapping"
"1106719","CLIMAAIR REVERSIBLE JACKET KID'S","KIDS & BABY","IV;NV;WRD","No mapping"
"1106720","CLIMAAIR REVERSIBLE JACKET KID'S","KIDS & BABY","BL;IV;PK","No mapping"
"1106723","CLIMABARRIER HOODED JACKET MEN'S","SOFT SHELL","BK;NV;OG","No mapping"
"1106724","CLIMABARRIER HOODED JACKET WOMEN'S","SOFT SHELL","BGN;BK;LGY","No mapping"
"1106746","CLIMAPLUS SHEARLING JACKET MEN'S","THERMAL","DBN;IV;NV","No mapping"
"1106747","CLIMAPLUS SHEARLING JACKET WOMEN'S","THERMAL","BN;IV;KH","No mapping"
"1106748","CLIMAPLUS SHEARLING VEST MEN'S","THERMAL","IV;NV","No mapping"
"1106749","CLIMAPLUS SHEARLING VEST WOMEN'S","THERMAL","IV;KH","No mapping"
"1106750","CLIMAPLUS SHEARLING CARDIGAN WOMEN'S","THERMAL","BK;IV;KH","No mapping"
"1106759","MITTELLEGI FULL-ZIP SWEATER MEN'S","THERMAL","BK;DGN;NV","No mapping"
"1106760","MITTELLEGI FULL-ZIP SWEATER WOMEN'S","THERMAL","IV;NV","No mapping"
"1106761","MITTELLEGI HALF-ZIP SWEATER MEN'S","THERMAL","DGY;OG","No mapping"
"1106762","MITTELLEGI SWEATER MEN'S","THERMAL","DGY;NV","No mapping"
"1106763","MITTELLEGI SWEATER WOMEN'S","THERMAL","IV;NV","No mapping"
"1106764","CLIMAPLUS SHEARLING JACKET KID'S","KIDS & BABY","IV;KH;NV","No mapping"
"1106765","CLIMAPLUS SHEARLING JACKET KID'S","KIDS & BABY","IV;KH;NV","No mapping"
"1106766","CLIMAPLUS SHEARLING VEST KID'S","KIDS & BABY","IV;NV","No mapping"
"1106767","CLIMAPLUS SHEARLING VEST KID'S","KIDS & BABY","IV;NV","No mapping"
"1106797","CLIMATWEED JACKET MEN'S","THERMAL","DGN;GY;RD","No mapping"
"1106798","CLIMATWEED JACKET WOMEN'S","THERMAL","BGN;IV;PU","No mapping"
"1106799","CLIMATWEED SHIRT MEN'S","THERMAL","DGN;GY;RD","No mapping"
"1106800","CLIMATWEED SHIRT WOMEN'S","THERMAL","BGN;IV;PU","No mapping"
"1106803","LIGHT SHELL HOODED JACKET KID'S","KIDS & BABY","BGN;BK;LGY;LV;RD","No mapping"
"1106804","LIGHT SHELL HOODED JACKET KID'S","KIDS & BABY","BGN;GN;LGN;LV;YL","No mapping"
"1106806","LIGHT SHELL JACKET KID'S","KIDS & BABY","BK;BL;LGY;LV","No mapping"
"1106807","LIGHT SHELL JACKET KID'S","KIDS & BABY","BL;LGN;LV;YL","No mapping"
"1107170","SUPER MERINO WOOL EXPEDITION ROUND NECK SHIRT WOMEN'S","BASE LAYER","BK;GY;WRD","No mapping"
"1107177","WICKRON LIGHT TRUNKS","BASE LAYER","BASM;IND;NV","No mapping"
"1107294","JACQUARD TIGHTS WOMEN'S","SUPPORTER & WARMER","DGY;HGY;KH;NV","No mapping"
"1107581","SUPER MERINO WOOL EXPEDITION ROUND NECK SHIRT MEN'S","BASE LAYER","BK;GY;NV","No mapping"
"1107583","SUPER MERINO WOOL EXPEDITION HIGH NECK SHIRT MEN'S","BASE LAYER","BK;GY","No mapping"
"1107584","SUPER MERINO WOOL EXPEDITION HIGH NECK SHIRT WOMEN'S","BASE LAYER","BK;WRD","No mapping"
"1107585","SUPER MERINO WOOL EXPEDITION TIGHTS MEN'S","BASE LAYER","BK","No mapping"
"1107586","SUPER MERINO WOOL EXPEDITION TIGHTS WOMEN'S","BASE LAYER","BK","No mapping"
"1107654","SUPER MERINO WOOL MIDDLE WEIGHT ROUND NECK SHIRT MEN'S","BASE LAYER","BK;DKNV;LTSV","No mapping"
"1107656","SUPER MERINO WOOL MIDDLE WEIGHT HIGH NECK SHIRT MEN'S","BASE LAYER","BK;DKNV","No mapping"
"1107657","SUPER MERINO WOOL MIDDLE WEIGHT HIGH NECK SHIRT WOMEN'S","BASE LAYER","BK","No mapping"
"1107659","SUPER MERINO WOOL MIDDLE WEIGHT TIGHTS MEN'S","BASE LAYER","BK;DKNV","No mapping"
"1107660","SUPER MERINO WOOL MIDDLE WEIGHT TIGHTS WOMEN'S","BASE LAYER","BK","No mapping"
"1107672","SUPER MERINO WOOL LIGHT WEIGHT SHORTS WOMEN'S","BASE LAYER","BK;LBL","No mapping"
"1107673","SUPER MERINO WOOL LIGHT WEIGHT ACTIVE SHORTS WOMEN'S","BASE LAYER","BK;LBL","No mapping"
"1107704","ZEO-LINE MIDDLE WEIGHT ROUND NECK SHIRT MEN'S","BASE LAYER","BK;DGN;LGY;NV","No mapping"
"1107706","ZEO-LINE MIDDLE WEIGHT HIGH NECK SHIRT MEN'S","BASE LAYER","BK;LGY;NV","No mapping"
"1107707","ZEO-LINE MIDDLE WEIGHT HIGH NECK SHIRT WOMEN'S","BASE LAYER","BK","No mapping"
"1107709","ZEO-LINE MIDDLE WEIGHT TIGHTS MEN'S","BASE LAYER","BK;DGN;LGY;NV","No mapping"
"1107712","ZEO-LINE EXPEDITION ROUND NECK SHIRT MEN'S","BASE LAYER","BK;NV","No mapping"
"1107713","ZEO-LINE EXPEDITION ROUND NECK SHIRT WOMEN'S","BASE LAYER","BK;BL","No mapping"
"1107714","ZEO-LINE EXPEDITION HIGH NECK SHIRT MEN'S","BASE LAYER","BK;NV","No mapping"
"1107715","ZEO-LINE EXPEDITION HIGH NECK SHIRT WOMEN'S","BASE LAYER","BK","No mapping"
"1107716","ZEO-LINE EXPEDITION TIGHTS MEN'S","BASE LAYER","BK","No mapping"
"1107717","ZEO-LINE EXPEDITION TIGHTS WOMEN'S","BASE LAYER","BK","No mapping"
"1107720","ZEO-LINE MIDDLE WEIGHT ROUND NECK SHIRT KID'S","KIDS & BABY","BK;NV","No mapping"
"1107721","ZEO-LINE MIDDLE WEIGHT ROUND NECK SHIRT KID'S","KIDS & BABY","BK;NV","No mapping"
"1107727","ZEO-LINE EXPEDITION ROUND NECK SHIRT KID'S","KIDS & BABY","BK;NV","No mapping"
"1107728","ZEO-LINE EXPEDITION ROUND NECK SHIRT KID'S","KIDS & BABY","BK;NV","No mapping"
"1107747","ZEO-LINE LIGHT WEIGHT SHORTS WOMEN'S","BASE LAYER","BK;LBL;TN","No mapping"
"1107749","ZEO-LINE LIGHT WEIGHT ACTIVE SHORTS WOMEN'S","BASE LAYER","BK;LBL;TN","No mapping"
"1107763","ZEO-LINE COOL MESH TRUNKS MEN'S","BASE LAYER","BK;LGY","No mapping"
"1107764","ZEO-LINE COOL MESH BRIEFS MEN'S","BASE LAYER","BK","No mapping"
"1107787","TRAIL TIGHTS MEN'S","SUPPORTER & WARMER","BK;NV","No mapping"
"1107788","TRAIL TIGHTS WOMEN'S","SUPPORTER & WARMER","BK;DGN;DGY;NV;PU","No mapping"
"1107807","SUPER MERINO WOOL LIGHT WEIGHT SOFT BRA","BASE LAYER","BK;LBL","No mapping"
"1107812","TRAIL TIGHTS KID'S","KIDS & BABY","BK;PU","No mapping"
"1107813","TRAIL TIGHTS KID'S","KIDS & BABY","BK;PU","No mapping"
"1107814","JACQUARD TIGHTS KID'S","KIDS & BABY","GY;NV","No mapping"
"1107815","JACQUARD TIGHTS KID'S","KIDS & BABY","GY;NV","No mapping"
"1107816","ZEO-LINE LIGHT WEIGHT SMOOTH SOFT BRA","BASE LAYER","BK;KH;TN","No mapping"
"1107818","ZEO-LINE LIGHT WEIGHT SMOOTH LOW RISE ACTIVE SHORTS WOMEN'S","BASE LAYER","BK;KH;TN","No mapping"
"1107819","ZEO-LINE LIGHT WEIGHT SMOOTH ACTIVE SHORTS WOMEN'S","BASE LAYER","BK;KH;TN","No mapping"
"1107824","SUPER MERINO WOOL LIGHT WEIGHT BRIEFS MEN'S","BASE LAYER","BK","No mapping"
"1107828","ZEO-LINE LIGHT WEIGHT BRIEFS MEN'S","BASE LAYER","BK;LGY","No mapping"
"1107832","SUPER MERINO WOOL EXPEDITION PLUS ROUND NECK SHIRT MEN'S","BASE LAYER","BK","No mapping"
"1107834","SUPER MERINO WOOL EXPEDITION PLUS TIGHTS MEN'S","BASE LAYER","BK","No mapping"
"1107835","SUPER MERINO WOOL EXPEDITION PLUS TIGHTS WOMEN'S","BASE LAYER","BK","No mapping"
"1108377","WOOL KNIT BILL CAP","CAP & HAT","DBN;DKNV;DKOV;OTML","No mapping"
"1108378","WOOL KNIT HUNTING","CAP & HAT","DBN;DKNV;DKOV","No mapping"
"1108379","WOOL KNIT HAT","CAP & HAT","DBN;DKNV;DKOV;OTML","No mapping"
"1108435","PARASOL HAT","CAP & HAT","LTN;MINE;NV","No mapping"
"1108513","POLAR MITTENS KID'S","KIDS & BABY","CPK;IB/DN;OTML","No mapping"
"1108709","CAMOUFLAGE WATCH HAT","CAP & HAT","","No colors"
"1108743","WIDE BRIM HAT","CAP & HAT","BK;BKNV;KH24;OVGN","No mapping"
"1108744","STRETCH O.D. HAT","CAP & HAT","GM;MALD;MSGN;TN","No mapping"
"1108767","MERINO WOOL JACQUARD LEG WARMERS","SOCKS","DGY;GY;LGY;TN","No mapping"
"1108808","MERINO WOOL SUPPORTEC WALKING SHORT SOCKS","SOCKS","CHGY;NV","No mapping"
"1108809","MERINO WOOL SUPPORTEC WALKING SOCKS","SOCKS","CHGY;NV","No mapping"
"1108895","CLIMAPLUS 200 MITTENS","GLOVES","HCH;NV;OTML","No mapping"
"1108896","KNIT HIGHLAND MUFFLER FOREST","SCARF AND NECK GAITER","BN;GY;NV;RD","No mapping"
"1109214","GLASSES STRAP","EYE WEAR","#13;#17;#20;#21;BK;DKNV","No mapping"
"1109216","STRETCH BELT SLIM BUCKLE","PANTS","CHBK;OV;SLBL;THYM","No mapping"
"1109232","ALUMINUM BUCKLE WEB BELT","PANTS","#1;#2;#3;#4;#5;#6","No mapping"
"1109233","STRETCH BELT","PANTS","#1;#2;#3;#4","No mapping"
"1109241","FLOATING 2-WAY GLASSES STRAP","EYE WEAR","BL;OG","No mapping"
"1109242","2-WAY GLASSES STRAP","EYE WEAR","#14;#15;#18;#19;BK;NV","No mapping"
"1109248","FLOATING 2-WAY DRY GLASSES STRAP","EYE WEAR","BL;OG","No mapping"
"1109249","2-WAY DRY GLASSES STRAP","EYE WEAR","BK","No mapping"
"1109280","GLASSES BAND","EYEWEAR","#13;#18;#19;#22;#23","No mapping"
"1114126","WOOL MOUNTAIN SHIRT MEN'S","SHIRTS","DBN;LGY;NV","No mapping"
"1114390","MOUNTAIN JERSEY JACKET MEN'S","KNIT SHIRTS","BK;BKNV;HGY","No mapping"
"1114391","MOUNTAIN JERSEY JACKET WOMEN'S","KNIT SHIRTS","BK;WTSM","No mapping"
"1114439","MERINO WOOL PLUS ACTION ZIP NECK MEN'S","KNIT SHIRTS","BK;BKOV;IND;OGRD","No mapping"
"1114442","MERINO WOOL PLUS STRIPED LONG SLEEVE T WOMEN'S","KNIT SHIRTS","BGN;ID/OF;LGY","No mapping"
"1114494","WICKRON LIGHT SINGLE POCKET LONG SLEEVE SHIRT WOMEN'S","SHIRTS","BL;GY;IV;LBL;NV;WT25","No mapping"
"1114544","WICKRON STRIPED LONG SLEEVE T WOMEN'S","KNIT SHIRTS","D/B-W;IV/DN;LG/IV;WT/RD","No mapping"
"1114547","WICKRON DRY TOUCH LONG SLEEVE SHIRT MEN'S","SHIRTS","DGY;LGN;MALD;NV;WRD;WT","No mapping"
"1114548","WICKRON DRY TOUCH LONG SLEEVE SHIRT WOMEN'S","SHIRTS","GN;LGY;LVBL;TN","No mapping"
"1114617","MERINO WOOL PLUS LIGHT LONG SLEEVE T MEN'S NORTHERN ANIMAL LOGO","KNIT SHIRTS","YL","No mapping"
"1114618","MERINO WOOL PLUS LIGHT LONG SLEEVE T WOMEN'S NORTHERN ANIMAL LOGO","KNIT SHIRTS","BL;DGY","No mapping"
"1114619","MERINO WOOL PLUS LIGHT LONG SLEEVE T MEN'S MOUNTAIN COLLAGE","KNIT SHIRTS","DGY","No mapping"
"1114620","MERINO WOOL PLUS LIGHT LONG SLEEVE T WOMEN'S MOUNTAIN COLLAGE","KNIT SHIRTS","NV","No mapping"
"1114670","WICKRON LIGHT STAND COLLAR SHIRT MEN'S","SHIRTS","BL;GN25;LGY25","No mapping"
"1114671","WICKRON LIGHT STAND COLLAR SHIRT WOMEN'S","SHIRTS","BL;GY;LGY;PK","No mapping"
"1114693","WICKRON RAGLAN LONG SLEEVE T MEN'S","KNIT SHIRTS","BGN;BN;DGY;DGY24;WT","No mapping"
"1114694","WICKRON RAGLAN LONG SLEEVE T WOMEN'S","KNIT SHIRTS","BGN;DGN;NV;PK;WT","No mapping"
"1114768","WICKRON LONG SLEEVE T WHITE MOUNTAIN RANGE","KNIT SHIRTS","NV;WT","No mapping"
"1114770","WICKRON LONG SLEEVE T GEAR CIRCLE","KNIT SHIRTS","DGY;IV","No mapping"
"1114771","WICKRON LONG SLEEVE T SHIROI YAMAOTOKO","KNIT SHIRTS","NV","No mapping"
"1114772","WICKRON LONG SLEEVE T MOUNTAIN GEAR","KNIT SHIRTS","KGN;PU","No mapping"
"1114773","WICKRON LONG SLEEVE T MONTA BEAR FACE","KNIT SHIRTS","BK","No mapping"
"1114795","WICKRON LONG SLEEVE T WOMEN'S MONTA BEAR FACE","KNIT SHIRTS","BK","No mapping"
"1114796","WICKRON LONG SLEEVE T WOMEN'S ROPE","KNIT SHIRTS","DGY;LBL","No mapping"
"1114797","WICKRON LONG SLEEVE T WOMEN'S MOUNTAIN GEAR","KNIT SHIRTS","KH;PU","No mapping"
"1114832","WICKRON LIGHT DOUBLE POCKET LONG SLEEVE SHIRT MEN'S","SHIRTS","BGN;BL;RD25;TN","No mapping"
"1114834","WICKRON LIGHT SINGLE POCKET LONG SLEEVE SHIRT MEN'S","SHIRTS","BGN;BL;CPK;DBN;DGY;GN25;GY25;TN;TN25","No mapping"
"1114852","WICKRON LONG SLEEVE T LAKESHORE","KNIT SHIRTS","DGY;IV","No mapping"
"1114859","WICKRON LONG SLEEVE T WOMEN'S LAKESHORE","KNIT SHIRTS","IV;NV","No mapping"
"1114881","CHAMEECE JACKET MEN'S","THERMAL","BK;BL;DGN;GY;IV;NV;OG","No mapping"
"1114882","CHAMEECE JACKET WOMEN'S","THERMAL","BL;CPK;CPK25;DGY;LGY;RD;YL","No mapping"
"1114883","CHAMEECE PULLOVER MEN'S","THERMAL","BL;DGY;IV;OG","No mapping"
"1114884","CHAMEECE PULLOVER WOMEN'S","THERMAL","CPK;DGY;IV","No mapping"
"1114885","CHAMEECE VEST MEN'S","THERMAL","BGN;BK;IV","No mapping"
"1114886","CHAMEECE VEST WOMEN'S","THERMAL","BL;DGY;LGY","No mapping"
"1114892","MEADOW SHIRT","SHIRTS","NV;TN","No mapping"
"1114894","CHAMEECE JACKET KID'S","KIDS & BABY","IV;LBL;NV","No mapping"
"1114895","CHAMEECE JACKET KID'S","KIDS & BABY","BL;LGY;OG","No mapping"
"1114896","CHAMEECE PULLOVER KID'S","KIDS & BABY","BK;IV","No mapping"
"1114897","CHAMEECE PULLOVER KID'S","KIDS & BABY","BL;LGY","No mapping"
"1114902","WICKRON LONG SLEEVE T KID'S MONTA BEAR FACE","KIDS & BABY","BK","No mapping"
"1114903","WICKRON LONG SLEEVE T KID'S MONTA BEAR FACE","KIDS & BABY","BK","No mapping"
"1114904","WICKRON LONG SLEEVE T KID'S CAMPING","KIDS & BABY","KH;RD","No mapping"
"1114905","WICKRON LONG SLEEVE T KID'S CAMPING","KIDS & BABY","KH;RD","No mapping"
"1114906","WICKRON LONG SLEEVE T KID'S JAPANESE BLACK BEAR","KIDS & BABY","DGY;LBL","No mapping"
"1114907","WICKRON LONG SLEEVE T KID'S JAPANESE BLACK BEAR","KIDS & BABY","DGY;LBL","No mapping"
"1114908","WICKRON LONG SLEEVE T KID'S JAPANESE SEROW","KIDS & BABY","LV;NV","No mapping"
"1114909","WICKRON LONG SLEEVE T KID'S JAPANESE SEROW","KIDS & BABY","LV;NV","No mapping"
"1114910","WICKRON LONG SLEEVE T KID'S LAKESHORE","KIDS & BABY","DGY;IV","No mapping"
"1114911","WICKRON LONG SLEEVE T KID'S LAKESHORE","KIDS & BABY","DGY;IV","No mapping"
"1114912","WICKRON RAGLAN LONG SLEEVE T KID'S SINCE 1975","KIDS & BABY","BGN","No mapping"
"1114913","WICKRON RAGLAN LONG SLEEVE T KID'S SINCE 1975","KIDS & BABY","BGN","No mapping"
"1114914","WICKRON RAGLAN LONG SLEEVE T KID'S MOUNTAIN & TENT","KIDS & BABY","OG","No mapping"
"1114915","WICKRON RAGLAN LONG SLEEVE T KID'S MOUNTAIN & TENT","KIDS & BABY","OG","No mapping"
"1114918","CHAMEECE CARDIGAN WOMEN'S","THERMAL","BL;DGY;IV;RD;YL","No mapping"
"1114959","WICKRON LONG SLEEVE T WINTER MOUNTAINEERING","KNIT SHIRTS","WT","No mapping"
"1114977","WICKRON LIGHT PRINT LONG SLEEVE SHIRT MEN'S","SHIRTS","IV;WT","No mapping"
"1114978","WICKRON LIGHT PRINT LONG SLEEVE SHIRT WOMEN'S","SHIRTS","BL;GN","No mapping"
"1118122","CHAMEECE MUFFLER KID'S","KIDS & BABY","BL;IV;NV;YL25","No mapping"
"1118163","CHAMEECE MUFFLER","SCARF AND NECK GAITER","BL;DGN25;DGY;IV25;LGY;LGY25;NV25;RD;YL25","No mapping"
"1118195","TRAIL ACTION GLOVES KID'S","KIDS & BABY","BLBK;CARNA","No mapping"
"1118198","REVERSIBLE EXCELOFT LEG WARMERS","SOCKS","DN/TB;GM/RB;PU24","No mapping"
"1118222","CHAMEECE GLOVES KID'S","KIDS & BABY","BL;CPK;DGY;YL25","No mapping"
"1118226","CHAMEECE FINGERLESS GLOVES MEN'S","GLOVES","BGN;BK;GM-C;OG","No mapping"
"1118227","CHAMEECE FINGERLESS GLOVES WOMEN'S","GLOVES","CPK;GM-C;GY;YL25","No mapping"
"1118237","REVERSIBLE ALPINE EAR WARMER CAP","CAP & HAT","BN;DGN;LTSV","No mapping"
"1118238","REVERSIBLE ALPINE CAP","CAP & HAT","BK;LTSV;NV","No mapping"
"1118239","MERINO WOOL KNIT 2-WAY CAP","SCARF AND NECK GAITER","CHBK;KH","No mapping"
"1118269","TRAIL ACTION GLOVES MEN'S","GLOVES","BK;BLBK;RD","No mapping"
"1118270","TRAIL ACTION GLOVES WOMEN'S","GLOVES","BK;LGY;WRD","No mapping"
"1118301","KAMICO TRAVEL 5 TOE ANKLE SOCKS MEN'S","SOCKS","DGY;KH;LGY","No mapping"
"1118309","KAMICO TRAVEL 5 TOE SOCKS MEN'S","SOCKS","BK;KH;LGY","No mapping"
"1118335","WICKRON O.D. HAT","CAP & HAT","DRD;GN;NV22;OG","No mapping"
"1118340","CLIMAAIR VOLCANO CAP","CAP & HAT","BK;CNBL;GARN;RSMT","No mapping"
"1118354","CLIMAAIR NECK GAITER","SCARF AND NECK GAITER","BK;CNBL;GARN;RSMT","No mapping"
"1118378","MERINO WOOL SUPPORTEC FULL PILE SNOW SPORT SOCKS","SOCKS","HCH;OVGN","No mapping"
"1118402","LIGHT JACQUARD TIBETAN CAP KID'S","KIDS & BABY","BL;GN;LV","No mapping"
"1118405","SUPER MERINO WOOL EXPEDITION NECK GAITER","SCARF AND NECK GAITER","BK;GY","No mapping"
"1118406","SUPER MERINO WOOL EXPEDITION NECK GAITER LONG","SCARF AND NECK GAITER","BK;GY","No mapping"
"1118416","MERINO WOOL EXPEDITION SOCKS MEN'S","SOCKS","HCH;OTML","No mapping"
"1118418","MERINO WOOL ALPINE SOCKS MEN'S","SOCKS","DKNV;DRD;HCH;OTML","No mapping"
"1118419","MERINO WOOL ALPINE SOCKS WOMEN'S","SOCKS","HCH;VT","No mapping"
"1118420","MERINO WOOL ALPINE HIGH SOCKS MEN'S","SOCKS","HCH;OTML","No mapping"
"1118421","MERINO WOOL TREKKING SOCKS MEN'S","SOCKS","BG;BKH;HCH;IND;SLBL","No mapping"
"1118478","CHAMEECE GLOVES MEN'S","GLOVES","BK;DGN;GM-C;GY;NV;OG","No mapping"
"1118479","CHAMEECE GLOVES WOMEN'S","GLOVES","CPK;GM-C;GY;IV;LGY;YL","No mapping"
"1118495","JACQUARD NECK WARMER","SCARF AND NECK GAITER","HCH;OPERA","No mapping"
"1118498","MERINO WOOL EXPEDITION SOCKS WOMEN'S","SOCKS","OTML;RD","No mapping"
"1118506","ZEO-LINE LIGHT WEIGHT SOCKS","SOCKS","BK;NV","No mapping"
